<?xml version="1.0" encoding="UTF-8"?>
<!DOCTYPE peripheralPage SYSTEM "_menu.dtd" >
<!-- ewm_def.xml -->

<peripheralPage xmlns:xi="http://www.w3.org/2001/XInclude" name="_instance" description="External Watchdog Monitor">

   <xi:include href="_default_instance.xml"/>

   <xi:include href="_default_pcr.xml"/>
   
   <xi:include href="_mapPinsOption.xml"/>  
   
   <template><![CDATA[
      \t//! IRQ numbers for hardware
      \tstatic constexpr IRQn_Type irqNums[]  = $(_name)_IRQS;\n\n
   
      \t//! Number of IRQs for hardware
      \tstatic constexpr uint32_t irqCount  = sizeof(irqNums)/sizeof(irqNums[0]);\n\n
   ]]></template>

   <irqOption name="irqHandlingMethod"  
      description="Peripheral interrupt handler"
      toolTip="This selection allow the interrupt handler for this peripheral to be installed using several different methods"
      pattern="^WDOG%i_?$"
      classHandler="%c%i::irqHandler" />

   <!-- Template is added to class within pin_mapping.h -->
   <template><![CDATA[
       \t//! Class based callback handler has been installed in vector table\n
       \tstatic constexpr bool irqHandlerInstalled = $(irqHandlingMethod);\n\n
   ]]></template>
       
   <intOption name="irqLevel" 
      description="IRQ Level in NVIC [0-15]"
      toolTip="Sets the priority level used to configure the NVIC\n
               Lower numbers represent higher priorities"
      value="8" min="0" max="15" 
   />

   <template><![CDATA[
       \t//! Default IRQ level\n
       \tstatic constexpr uint32_t irqLevel =  $(irqLevel);\n\n
   ]]></template>
   
   <xi:include href="_clockOption.xml"/>

   <projectActionList id = "ewm_files" >
      <copy source="Project_Headers/ewm.h"          target="Project_Headers/ewm.h"          overwrite="true" derived="true" />
      <copy source="Snippets/ewm-example.cpp"       target="Snippets/ewm-example.cpp"       overwrite="true" derived="true" />
   </projectActionList>
   
   <signals/>
   
</peripheralPage>
