<?xml version="1.0" encoding="UTF-8"?>
<!DOCTYPE peripheralPage SYSTEM "_menu.dtd" >
<!-- usb_clkrcv_def.xml -->
<!--
Devices using this peripheral: 
-->
<peripheralPage xmlns:xi="http://www.w3.org/2001/XInclude" name="_instance" description="USB">

   <aliasOption key="/MCG/system_usb_clkin_clock" constant="false" optional="true"/>
   <aliasOption key="/SIM/sim_sopt2_usbsrc" constant="false" optional="true"/>
   <aliasOption key="/SIM/sim_clkdiv2_usb" constant="false" optional="true"/>
   <aliasOption key="/SIM/system_usbfs_clock" optional="true"/>

   <xi:include href="usb_clkrcv.xml"/>

   <xi:include href="_irqOption.xml"/>

   <validate
      class="net.sourceforge.usbdm.deviceEditor.validators.PeripheralValidator">
   </validate>

   <xi:include href="usb_files.xml"/>

   <signals/>
</peripheralPage>
